[Port3]  :  USB Composite Device


Is Port User Connectable:         yes
Is Port Debug Capable:            no
Companion Port Number:            3
Companion Hub Symbolic Link Name: USB#VID_05E3&PID_0625#5&232b4dd6&0&18#{f18a0e88-c30c-11d0-8815-00a0c906bed8}
Protocols Supported:
 USB 1.1:                         yes
 USB 2.0:                         yes
 USB 3.0:                         no

Device Power State:               PowerDeviceD0

       ---===>Device Information<===---
English product name: "STM32 USB Composite Keypad+CDC+Bulk"

ConnectionStatus:                  
Current Config Value:              0x01  -> Device Bus Speed: Full (is not SuperSpeed or higher capable)
Device Address:                    0x2B
Open Pipes:                           5

          ===>Device Descriptor<===
bLength:                           0x12
bDescriptorType:                   0x01
bcdUSB:                          0x0200
bDeviceClass:                      0xEF  -> This is a Multi-interface Function Code Device
bDeviceSubClass:                   0x02  -> This is the Common Class Sub Class
bDeviceProtocol:                   0x01  -> This is the Interface Association Descriptor protocol
bMaxPacketSize0:                   0x40 = (64) Bytes
idVendor:                        0x0483 = STMicroelectronics
idProduct:                       0x572B
bcdDevice:                       0x0200
iManufacturer:                     0x01
     English (United States)  "Hao Embedded Lab"
iProduct:                          0x02
     English (United States)  "STM32 USB Composite Keypad+CDC+Bulk"
iSerialNumber:                     0x03
     English (United States)  "000000000001"
bNumConfigurations:                0x01

          ---===>Open Pipes<===---

          ===>Endpoint Descriptor<===
bLength:                           0x07
bDescriptorType:                   0x05
bEndpointAddress:                  0x81  -> Direction: IN - EndpointID: 1
bmAttributes:                      0x03  -> Interrupt Transfer Type
wMaxPacketSize:                  0x0008 = 0x08 bytes
bInterval:                         0x0A

          ===>Endpoint Descriptor<===
bLength:                           0x07
bDescriptorType:                   0x05
bEndpointAddress:                  0x82  -> Direction: IN - EndpointID: 2
bmAttributes:                      0x03  -> Interrupt Transfer Type
wMaxPacketSize:                  0x0008 = 0x08 bytes
bInterval:                         0x10

          ===>Endpoint Descriptor<===
bLength:                           0x07
bDescriptorType:                   0x05
bEndpointAddress:                  0x84  -> Direction: IN - EndpointID: 4
bmAttributes:                      0x02  -> Bulk Transfer Type
wMaxPacketSize:                  0x0040 = 0x40 bytes
bInterval:                         0x00

          ===>Endpoint Descriptor<===
bLength:                           0x07
bDescriptorType:                   0x05
bEndpointAddress:                  0x03  -> Direction: OUT - EndpointID: 3
bmAttributes:                      0x02  -> Bulk Transfer Type
wMaxPacketSize:                  0x0040 = 0x40 bytes
bInterval:                         0x00

          ===>Endpoint Descriptor<===
bLength:                           0x07
bDescriptorType:                   0x05
bEndpointAddress:                  0x83  -> Direction: IN - EndpointID: 3
bmAttributes:                      0x02  -> Bulk Transfer Type
wMaxPacketSize:                  0x0040 = 0x40 bytes
bInterval:                         0x00

       ---===>Full Configuration Descriptor<===---

          ===>Configuration Descriptor<===
bLength:                           0x09
bDescriptorType:                   0x02
wTotalLength:                    0x0074  -> Validated
bNumInterfaces:                    0x04
bConfigurationValue:               0x01
iConfiguration:                    0x00
bmAttributes:                      0xC0  -> Self Powered
MaxPower:                          0x32 = 100 mA

          ===>Interface Descriptor<===
bLength:                           0x09
bDescriptorType:                   0x04
bInterfaceNumber:                  0x00
bAlternateSetting:                 0x00
bNumEndpoints:                     0x01
bInterfaceClass:                   0x03  -> HID Interface Class
bInterfaceSubClass:                0x01
bInterfaceProtocol:                0x01
iInterface:                        0x00

          ===>HID Descriptor<===
bLength:                           0x09
bDescriptorType:                   0x21
bcdHID:                          0x0111
bCountryCode:                      0x00
bNumDescriptors:                   0x01
bDescriptorType:                   0x22 (Report Descriptor)
wDescriptorLength:               0x002D

          ===>Endpoint Descriptor<===
bLength:                           0x07
bDescriptorType:                   0x05
bEndpointAddress:                  0x81  -> Direction: IN - EndpointID: 1
bmAttributes:                      0x03  -> Interrupt Transfer Type
wMaxPacketSize:                  0x0008 = 0x08 bytes
bInterval:                         0x0A

          ===>IAD Descriptor<===
bLength:                           0x08
bDescriptorType:                   0x0B
bFirstInterface:                   0x01
bInterfaceCount:                   0x02
bFunctionClass:                    0x02  -> This is Communications (CDC Control) USB Device Interface Class
bFunctionSubClass:                 0x02
bFunctionProtocol:                 0x01
iFunction:                         0x00

          ===>Interface Descriptor<===
bLength:                           0x09
bDescriptorType:                   0x04
bInterfaceNumber:                  0x01
bAlternateSetting:                 0x00
bNumEndpoints:                     0x01
bInterfaceClass:                   0x02  -> This is Communications (CDC Control) USB Device Interface Class
bInterfaceSubClass:                0x02
bInterfaceProtocol:                0x01
iInterface:                        0x00
  -> This is a Communications (CDC Control) USB Device Interface Class

          ===>Descriptor Hex Dump<===
bLength:                           0x05
bDescriptorType:                   0x24
05 24 00 10 01 
  -> This is a Communications (CDC Control) USB Device Interface Class

          ===>Descriptor Hex Dump<===
bLength:                           0x05
bDescriptorType:                   0x24
05 24 01 00 02 
  -> This is a Communications (CDC Control) USB Device Interface Class

          ===>Descriptor Hex Dump<===
bLength:                           0x04
bDescriptorType:                   0x24
04 24 02 02 
  -> This is a Communications (CDC Control) USB Device Interface Class

          ===>Descriptor Hex Dump<===
bLength:                           0x05
bDescriptorType:                   0x24
05 24 06 01 02 

          ===>Endpoint Descriptor<===
bLength:                           0x07
bDescriptorType:                   0x05
bEndpointAddress:                  0x82  -> Direction: IN - EndpointID: 2
bmAttributes:                      0x03  -> Interrupt Transfer Type
wMaxPacketSize:                  0x0008 = 0x08 bytes
bInterval:                         0x10

          ===>Interface Descriptor<===
bLength:                           0x09
bDescriptorType:                   0x04
bInterfaceNumber:                  0x02
bAlternateSetting:                 0x00
bNumEndpoints:                     0x02
bInterfaceClass:                   0x0A  -> This is a CDC Data USB Device Interface Class
bInterfaceSubClass:                0x00
bInterfaceProtocol:                0x00
iInterface:                        0x00

          ===>Endpoint Descriptor<===
bLength:                           0x07
bDescriptorType:                   0x05
bEndpointAddress:                  0x03  -> Direction: OUT - EndpointID: 3
bmAttributes:                      0x02  -> Bulk Transfer Type
wMaxPacketSize:                  0x0040 = 0x40 bytes
bInterval:                         0x00

          ===>Endpoint Descriptor<===
bLength:                           0x07
bDescriptorType:                   0x05
bEndpointAddress:                  0x83  -> Direction: IN - EndpointID: 3
bmAttributes:                      0x02  -> Bulk Transfer Type
wMaxPacketSize:                  0x0040 = 0x40 bytes
bInterval:                         0x00

          ===>Interface Descriptor<===
bLength:                           0x09
bDescriptorType:                   0x04
bInterfaceNumber:                  0x03
bAlternateSetting:                 0x00
bNumEndpoints:                     0x01
bInterfaceClass:                   0xFF  -> Interface Class Unknown to USBView
bInterfaceSubClass:                0x00
bInterfaceProtocol:                0x00
iInterface:                        0x00

          ===>Endpoint Descriptor<===
bLength:                           0x07
bDescriptorType:                   0x05
bEndpointAddress:                  0x84  -> Direction: IN - EndpointID: 4
bmAttributes:                      0x02  -> Bulk Transfer Type
wMaxPacketSize:                  0x0040 = 0x40 bytes
bInterval:                         0x00
